Year,School Name,DBN,School Code,School Level,Leadership,Teachers,Other Staff,Male Count,Male Average Years in Title,Male Average Years at School,Female Count,Female Average Years in Title,Female Average Years at School
2023,ACADEMY FOR SOFTWARE ENGINEERING,02M546,M546,HIGH SCHOOL,3,32,13,15,8,4.1,17,6,4.3
2023,BRONX LEGACY HIGH SCHOOL,07X625,X625,HIGH SCHOOL,2,16,4,5,0.6,0.4,11,8.1,0.3
2023,BRONX ARENA HIGH SCHOOL,08X537,X537,HIGH SCHOOL,2,14,2,7,12.8,6.1,7,13.1,8
2023,THE EAST NEW YORK ARTS AND CIVICS HIGH SCHOOL,19K953,K953,HIGH SCHOOL,2,12,4,*,,,*,,
2023,GOTHAM TECH HIGH SCHOOL,30Q417,Q417,HIGH SCHOOL,1,7,2,*,,,*,,
2023,47 THE AMERICAN SIGN LANGUAGE AND ENGLISH SECONDAR,71M047,M047,HIGH SCHOOL,3,35,5,15,6.2,2.9,20,5.5,4.1
2023,THE URBAN ASSEMBLY SCHOOL FOR EMERGENCY MANAGEMENT,71M135,M135,HIGH SCHOOL,3,25,4,11,5.9,4.1,14,8.8,3.6
2023,STEPHEN T. MATHER BUILDING ARTS & CRAFTSMANSHIP HI,71M139,M139,HIGH SCHOOL,3,35,11,14,7.2,3.9,21,6.2,2.9
2023,THE URBAN ASSEMBLY SCHOOL FOR GLOBAL COMMERCE,71M157,M157,HIGH SCHOOL,2,21,5,12,5.1,3.2,9,6.2,1.7
2023,INWOOD EARLY COLLEGE FOR HEALTH AND INFORMATION TE,71M211,M211,HIGH SCHOOL,3,37,9,14,10.6,4.8,23,8.4,3.2
2023,MANHATTAN EARLY COLLEGE SCHOOL FOR ADVERTISING,71M280,M280,HIGH SCHOOL,3,38,5,12,7,4.6,26,6.5,3.1
2023,URBAN ASSEMBLY MAKER ACADEMY,71M282,M282,HIGH SCHOOL,4,46,7,16,7.6,2.9,30,5.8,2
2023,HARLEM RENAISSANCE HIGH SCHOOL,71M285,M285,HIGH SCHOOL,2,13,4,5,22.1,12.1,8,12.4,4.8
2023,FOOD AND FINANCE HIGH SCHOOL,71M288,M288,HIGH SCHOOL,3,32,6,17,11.9,7.6,15,8.3,6
2023,ORCHARD COLLEGIATE ACADEMY,71M292,M292,HIGH SCHOOL,2,25,5,14,11.2,6.2,11,7.9,4.2
2023,ESSEX STREET ACADEMY,71M294,M294,HIGH SCHOOL,2,30,4,12,10.2,6.5,18,12.2,7.2
2023,HIGH SCHOOL OF HOSPITALITY MANAGEMENT,71M296,M296,HIGH SCHOOL,2,20,5,7,15.2,10.4,13,15.1,9.2
2023,PACE HIGH SCHOOL,71M298,M298,HIGH SCHOOL,4,45,8,22,12.5,8.5,23,10.4,5.7
2023,THE MAXINE GREENE HS FOR IMAGINATIVE INQUIRY,71M299,M299,HIGH SCHOOL,2,14,3,7,16.9,8.8,7,11.6,6.1
2023,URBAN ASSEMBLY SCHOOL OF DESIGN AND CONSTRUCTION,71M300,M300,HIGH SCHOOL,1,26,6,10,9.2,4.9,16,9.1,5.7
2023,FACING HISTORY SCHOOL  THE,71M303,M303,HIGH SCHOOL,2,31,6,10,8.6,6.6,21,8.4,5.2
2023,MOTT HALL HIGH SCHOOL,71M304,M304,HIGH SCHOOL,2,17,6,6,7.5,4.4,11,8.5,2.4
2023,URBAN ASSEMBLY ACADEMY OF GOVERNMENT AND LAW  THE,71M305,M305,HIGH SCHOOL,2,24,7,12,8,4.1,12,7.8,4.8
2023,URBAN ASSEMBLY SCHOOL FOR MEDIA STUDIES  THE,71M307,M307,HIGH SCHOOL,3,30,15,11,9.5,7.9,19,5.6,3.9
2023,LOWER MANHATTAN ARTS ACADEMY,71M308,M308,HIGH SCHOOL,1,26,7,14,9.1,3.4,12,6.8,4.4
2023,THE JUDITH S. KAYE SCHOOL,71M310,M310,HIGH SCHOOL,3,11,1,5,14,3,6,15.9,3.5
2023,JAMES BALDWIN SCHOOL  THE: A SCHOOL FOR EXPEDITION,71M313,M313,HIGH SCHOOL,2,16,5,7,13.3,9,9,11.9,8.3
2023,URBAN ASSEMBLY SCHOOL OF BUSINESS FOR YOUNG WOMEN,71M316,M316,HIGH SCHOOL,1,9,4,*,,,*,,
2023,URBAN ASSEMBLY SCHOOL FOR THE PERFORMING ARTS,71M369,M369,HIGH SCHOOL,2,24,8,9,9.3,4.5,15,8.4,4.3
2023,GRAMERCY ARTS HIGH SCHOOL,71M374,M374,HIGH SCHOOL,3,37,12,15,7,4.1,22,5.9,2.9
2023,NYC ISCHOOL,71M376,M376,HIGH SCHOOL,2,37,8,15,8.9,5.5,22,9.2,5.2
2023,MANHATTAN BUSINESS ACADEMY,71M392,M392,HIGH SCHOOL,3,32,3,15,10.2,6.6,17,9.2,4.2
2023,BUSINESS OF SPORTS SCHOOL,71M393,M393,HIGH SCHOOL,3,37,6,16,9.5,5.2,21,10.9,5.4
2023,EMMA LAZARUS HIGH SCHOOL,71M394,M394,HIGH SCHOOL,3,18,6,5,12.1,7.5,13,9.2,4.5
2023,THE HIGH SCHOOL FOR LANGUAGE AND DIPLOMACY,71M399,M399,HIGH SCHOOL,3,15,4,8,11.6,6.3,7,14,5.7
2023,HIGH SCHOOL FOR ENVIRONMENTAL STUDIES,71M400,M400,HIGH SCHOOL,7,72,13,27,11.1,7.4,45,10.1,5.6
2023,THE URBAN ASSEMBLY SCHOOL FOR GREEN CAREERS,71M402,M402,HIGH SCHOOL,1,28,6,10,7.9,4,18,3.9,2.1
2023,THE GLOBAL LEARNING COLLABORATIVE,71M403,M403,HIGH SCHOOL,3,34,7,16,9.4,5.9,18,13.7,5.5
2023,INNOVATION DIPLOMA PLUS,71M404,M404,HIGH SCHOOL,2,12,2,5,8.1,3.9,7,14.1,9.5
2023,BARUCH COLLEGE CAMPUS HIGH SCHOOL,71M411,M411,HIGH SCHOOL,3,30,6,8,10.7,7.5,22,7.7,3.9
2023,N.Y.C. LAB SCHOOL FOR COLLABORATIVE STUDIES,71M412,M412,HIGH SCHOOL,3,47,17,15,11,7.3,32,9.8,5.3
2023,N.Y.C. MUSEUM SCHOOL,71M414,M414,HIGH SCHOOL,3,32,8,11,13.5,5.6,21,13.4,5.3
2023,ELEANOR ROOSEVELT HIGH SCHOOL,71M416,M416,HIGH SCHOOL,2,34,5,16,13,9.7,18,10.9,7.3
2023,FRANK MCCOURT HIGH SCHOOL,71M417,M417,HIGH SCHOOL,2,31,6,11,5.2,1.8,20,8.8,4.9
2023,MILLENNIUM HIGH SCHOOL,71M418,M418,HIGH SCHOOL,3,43,5,11,12.5,8.3,32,10.2,8
2023,LANDMARK HIGH SCHOOL,71M419,M419,HIGH SCHOOL,3,32,10,12,8.9,6.5,20,7.3,4.8
2023,HIGH SCHOOL FOR HEALTH PROFESSIONS AND HUMAN SERVI,71M420,M420,HIGH SCHOOL,10,97,20,43,12.4,9.6,54,11.6,9.1
2023,HIGH SCHOOL FOR EXCELLENCE AND INNOVATION,71M423,M423,HIGH SCHOOL,2,15,3,9,8.6,4.6,6,16.4,5.8
2023,LEADERSHIP AND PUBLIC SERVICE HIGH SCHOOL,71M425,M425,HIGH SCHOOL,2,20,6,9,11.5,5.3,11,12.1,8.7
2023,MANHATTAN ACADEMY FOR ARTS & LANGUAGE,71M427,M427,HIGH SCHOOL,3,15,4,5,11.6,8.4,10,9.9,6.5
2023,MURRAY HILL ACADEMY,71M432,M432,HIGH SCHOOL,2,20,7,8,12.3,6.6,12,11.9,6.6
2023,MANHATTAN CENTER FOR SCIENCE AND MATHEMATICS,71M435,M435,HIGH SCHOOL,8,88,14,30,12.5,9.8,58,7.2,5.4
2023,HUDSON HIGH SCHOOL OF LEARNING TECHNOLOGIES,71M437,M437,HIGH SCHOOL,3,18,8,8,14.9,4.8,10,7.4,1.7
2023,INTERNATIONAL HIGH SCHOOL AT UNION SQUARE,71M438,M438,HIGH SCHOOL,2,25,6,14,12.8,7.7,11,8.3,7.2
2023,MANHATTAN VILLAGE ACADEMY,71M439,M439,HIGH SCHOOL,3,30,5,14,8.7,7,16,11.9,9.1
2023,UNIVERSITY NEIGHBORHOOD HIGH SCHOOL,71M448,M448,HIGH SCHOOL,3,39,11,18,4.8,2.8,21,8.8,5.8
2023,VANGUARD HIGH SCHOOL,71M449,M449,HIGH SCHOOL,2,33,7,9,9.9,8.7,24,10.5,6.2
2023,FORSYTH SATELLITE ACADEMY,71M458,M458,HIGH SCHOOL,2,11,4,*,,,*,,
2023,MANHATTAN INTERNATIONAL HIGH SCHOOL,71M459,M459,HIGH SCHOOL,3,23,7,8,6.3,4.8,15,9.9,7.6
2023,THE COLLEGE ACADEMY,71M462,M462,HIGH SCHOOL,4,28,13,14,12.3,9.6,14,6.9,4.4
2023,HIGH SCHOOL FOR MEDIA AND COMMUNICATIONS,71M463,M463,HIGH SCHOOL,3,28,7,11,12.4,9.1,17,7.1,4.8
2023,HIGH SCHOOL FOR LAW AND PUBLIC SERVICE,71M467,M467,HIGH SCHOOL,4,37,15,11,8.5,7.3,26,11.5,9.1
2023,HIGH SCHOOL FOR HEALTH CAREERS AND SCIENCES,71M468,M468,HIGH SCHOOL,4,29,10,13,13.3,8.5,16,11.5,6.8
2023,STUYVESANT HIGH SCHOOL,71M475,M475,HIGH SCHOOL,11,154,32,76,16.2,11.5,78,15.5,11.3
2023,BEACON HIGH SCHOOL,71M479,M479,HIGH SCHOOL,4,84,15,36,13.6,8.5,48,11.6,5.5
2023,FIORELLO H. LAGUARDIA HIGH SCHOOL OF MUSIC & ART A,71M485,M485,HIGH SCHOOL,14,149,23,61,13.9,9.2,88,13.4,10
2023,HIGH SCHOOL OF ECONOMICS AND FINANCE,71M489,M489,HIGH SCHOOL,4,47,7,24,8.9,5.6,23,10.3,6.8
2023,HIGH SCHOOL FOR LAW  ADVOCACY AND COMMUNITY JUSTIC,71M492,M492,HIGH SCHOOL,2,31,8,10,12.2,8.7,21,11.6,7.5
2023,HIGH SCHOOL OF ARTS AND TECHNOLOGY,71M494,M494,HIGH SCHOOL,4,36,10,10,9.6,3.8,26,10.3,4.2
2023,PARK EAST HIGH SCHOOL,71M495,M495,HIGH SCHOOL,3,35,8,19,10.1,6.4,16,13.4,10
2023,UNITY CENTER FOR URBAN TECHNOLOGIES,71M500,M500,HIGH SCHOOL,3,17,5,8,7.5,6.5,9,5.4,3.6
2023,EDWARD A. REYNOLDS WEST SIDE HIGH SCHOOL,71M505,M505,HIGH SCHOOL,1,24,4,13,17.2,14.2,11,16.5,10.4
2023,URBAN ASSEMBLY GATEWAY SCHOOL FOR TECHNOLOGY,71M507,M507,HIGH SCHOOL,2,38,10,19,7.3,4.8,19,7.2,4.8
2023,LOWER EAST SIDE PREPARATORY HIGH SCHOOL,71M515,M515,HIGH SCHOOL,2,36,8,10,13.6,12.6,26,10.4,8
2023,TALENT UNLIMITED HIGH SCHOOL,71M519,M519,HIGH SCHOOL,3,34,10,13,11.5,8.2,21,8.9,4.9
2023,MURRY BERGTRAUM HIGH SCHOOL FOR BUSINESS CAREERS,71M520,M520,HIGH SCHOOL,1,15,6,8,21.7,16.7,7,11.3,6.9
2023,JACQUELINE KENNEDY ONASSIS HIGH SCHOOL,71M529,M529,HIGH SCHOOL,2,20,6,6,9.4,4.3,14,11.2,7.4
2023,REPERTORY COMPANY HIGH SCHOOL FOR THEATRE ARTS,71M531,M531,HIGH SCHOOL,3,18,4,6,10.2,2.5,12,5.9,2.8
2023,UNION SQUARE ACADEMY FOR HEALTH SCIENCES,71M533,M533,HIGH SCHOOL,3,34,6,16,7.8,5.3,18,7.2,4.7
2023,HARVEST COLLEGIATE HIGH SCHOOL,71M534,M534,HIGH SCHOOL,3,37,5,14,9.1,5.1,23,9.6,3.6
2023,A. PHILIP RANDOLPH CAMPUS HIGH SCHOOL,71M540,M540,HIGH SCHOOL,8,83,26,45,12.8,7,38,11.2,6.9
2023,MANHATTAN / HUNTER SCIENCE HIGH SCHOOL,71M541,M541,HIGH SCHOOL,3,27,5,15,11.5,8.4,12,8.8,7
2023,MANHATTAN BRIDGES HIGH SCHOOL,71M542,M542,HIGH SCHOOL,2,33,7,10,12,7.7,23,9.5,5.1
2023,NEW DESIGN HIGH SCHOOL,71M543,M543,HIGH SCHOOL,3,47,9,16,9.7,7.2,31,9.9,5.3
2023,INDEPENDENCE HIGH SCHOOL,71M544,M544,HIGH SCHOOL,2,23,4,12,13.1,6.7,11,9.5,5.8
2023,HIGH SCHOOL FOR DUAL LANGUAGE AND ASIAN STUDIES,71M545,M545,HIGH SCHOOL,2,23,5,10,10.4,5.4,13,8.8,8.2
2023,LIBERTY HIGH SCHOOL ACADEMY FOR NEWCOMERS,71M550,M550,HIGH SCHOOL,3,29,7,10,12.1,5.4,19,9.7,6.5
2023,URBAN ASSEMBLY NEW YORK HARBOR SCHOOL,71M551,M551,HIGH SCHOOL,4,41,11,25,10.4,5.9,16,12,6
2023,GREGORIO LUPERON HIGH SCHOOL FOR SCIENCE AND MATHE,71M552,M552,HIGH SCHOOL,4,38,9,18,12.5,6.7,20,10.9,7
2023,CENTRAL PARK EAST HIGH SCHOOL,71M555,M555,HIGH SCHOOL,3,34,9,9,9.6,7.6,25,10.2,8.5
2023,HIGH SCHOOL M560 - CITY AS SCHOOL,71M560,M560,HIGH SCHOOL,3,36,11,10,15.7,8.7,26,14.4,6.7
2023,URBAN ACADEMY LABORATORY HIGH SCHOOL,71M565,M565,HIGH SCHOOL,1,15,4,*,,,*,,
2023,SATELLITE ACADEMY HIGH SCHOOL,71M570,M570,HIGH SCHOOL,2,12,3,*,,,*,,
2023,MANHATTAN COMPREHENSIVE NIGHT AND DAY HIGH SCHOOL,71M575,M575,HIGH SCHOOL,6,44,14,26,11,7.3,18,13.4,8.5
2023,RICHARD R. GREEN HIGH SCHOOL OF TEACHING,71M580,M580,HIGH SCHOOL,2,22,4,12,17.3,14.4,10,16.5,10.8
2023,HARVEY MILK HIGH SCHOOL,71M586,M586,HIGH SCHOOL,2,10,3,*,,,*,,
2023,THE HIGH SCHOOL OF FASHION INDUSTRIES,71M600,M600,HIGH SCHOOL,13,110,34,29,8.8,7.1,81,9.3,6.6
2023,HUMANITIES PREPARATORY ACADEMY,71M605,M605,HIGH SCHOOL,2,21,4,6,14.5,5.8,15,11.3,6.3
2023,CHELSEA CAREER AND TECHNICAL EDUCATION HIGH SCHOOL,71M615,M615,HIGH SCHOOL,3,34,12,13,13.4,9.4,21,13.5,6.3
2023,ART AND DESIGN HIGH SCHOOL,71M630,M630,HIGH SCHOOL,8,97,21,42,11.2,8.6,55,8.4,6
2023,CASCADES HIGH SCHOOL,71M650,M650,HIGH SCHOOL,2,13,3,5,12.9,9.5,8,12.5,5.4
2023,THE HIGH SCHOOL FOR CLIMATE JUSTICE,71M655,M655,HIGH SCHOOL,3,27,7,17,11.5,9.2,10,10,8.2
2023,HERITAGE SCHOOL  THE,71M680,M680,HIGH SCHOOL,3,22,6,11,7.5,4.1,11,5.3,2.9
2023,HIGH SCHOOL FOR MATHEMATICS  SCIENCE AND ENGINEERI,71M692,M692,HIGH SCHOOL,2,31,6,22,14.6,11.7,9,15.4,6.1
2023,BARD HIGH SCHOOL EARLY COLLEGE,71M696,M696,HIGH SCHOOL,3,43,6,23,13,8.8,20,10.9,6.5
2023,BRONX ENGINEERING AND TECHNOLOGY ACADEMY,72X213,X213,HIGH SCHOOL,3,31,9,16,17.2,9,15,12.7,6.3
2023,BRONX COLLEGIATE ACADEMY,72X227,X227,HIGH SCHOOL,5,27,10,12,10,7.8,15,12.9,8.7
2023,THE MARIE CURIE SCHOOL FOR MEDICINE  NURSING  AND,72X237,X237,HIGH SCHOOL,2,25,6,13,13.7,8.2,12,13.2,7.2
2023,METROPOLITAN HIGH SCHOOL  THE,72X248,X248,HIGH SCHOOL,3,20,6,10,17.8,3.1,10,11.3,4.4
2023,BRONX HEALTH SCIENCES HIGH SCHOOL,72X249,X249,HIGH SCHOOL,3,25,6,15,7.3,4.9,10,11.1,6.3
2023,EXIMIUS COLLEGE PREPARATORY ACADEMY: A COLLEGE BOA,72X250,X250,HIGH SCHOOL,3,28,10,10,12.7,6,18,9.9,5.9
2023,EXPLORATIONS ACADEMY H.S.,72X251,X251,HIGH SCHOOL,3,27,10,12,8.3,6.3,15,9.9,4
2023,MOTT HALL BRONX HIGH SCHOOL,72X252,X252,HIGH SCHOOL,2,31,7,16,6.4,3.3,15,5.9,4.4
2023,BRONX HIGH SCHOOL FOR WRITING AND COMMUNICATION AR,72X253,X253,HIGH SCHOOL,2,18,11,6,11.6,7.8,12,16.4,7.8
2023,H.E.R.O. HIGH (HEALTH  EDUCATION  AND RESEARCH OCC,72X259,X259,HIGH SCHOOL,3,70,13,24,8.3,3.2,46,7.6,3.1
2023,BRONX CENTER FOR SCIENCE AND MATHEMATICS,72X260,X260,HIGH SCHOOL,4,30,7,11,10.1,5.4,19,7,4.6
2023,VALIDUS PREPARATORY ACADEMY,72X263,X263,HIGH SCHOOL,2,24,9,13,10.6,7,11,12.7,6.6
2023,BRONX ACADEMY FOR SOFTWARE ENGINEERING (BASE),72X264,X264,HIGH SCHOOL,3,39,10,16,8.1,4.3,23,10.6,4.3
2023,BRONX LAB SCHOOL,72X265,X265,HIGH SCHOOL,3,23,8,9,12.2,8.2,14,13,8.3
2023,KINGSBRIDGE INTERNATIONAL HIGH SCHOOL,72X268,X268,HIGH SCHOOL,2,18,8,12,18.3,9.7,6,12.7,7.1
2023,ACADEMY FOR SCHOLARSHIP AND ENTREPRENEURSHIP: A CO,72X270,X270,HIGH SCHOOL,3,28,9,11,14.1,7.6,17,13.3,8
2023,HIGH SCHOOL OF COMPUTERS AND TECHNOLOGY,72X275,X275,HIGH SCHOOL,4,35,10,18,16.9,9.3,17,11.4,7.8
2023,WOMEN'S ACADEMY OF EXCELLENCE,72X282,X282,HIGH SCHOOL,2,17,7,6,15.2,5.8,11,16,7.8
2023,BRONX SCHOOL OF LAW AND FINANCE,72X284,X284,HIGH SCHOOL,3,25,10,9,14.5,9.7,16,11,7.2
2023,COLLEGIATE INSTITUTE FOR MATH AND SCIENCE,72X288,X288,HIGH SCHOOL,4,32,10,10,12.4,4.8,22,13.3,4.8
2023,BRONX ACADEMY OF HEALTH CAREERS,72X290,X290,HIGH SCHOOL,3,26,7,9,9.3,6.5,17,8.6,5.3
2023,RENAISSANCE HIGH SCHOOL FOR MUSICAL THEATER AND TH,72X293,X293,HIGH SCHOOL,3,34,9,19,8.5,5.9,15,11.4,6.5
2023,MORRIS ACADEMY FOR COLLABORATIVE STUDIES,72X297,X297,HIGH SCHOOL,3,38,10,17,5.2,3.4,21,10.4,7.7
2023,ASTOR COLLEGIATE ACADEMY,72X299,X299,HIGH SCHOOL,3,32,10,16,14.6,9.5,16,9,6.7
2023,MILLENNIUM ART ACADEMY,72X312,X312,HIGH SCHOOL,3,36,6,12,9.1,6.9,24,12.7,6.4
2023,PROVIDING URBAN LEARNERS SUCCESS IN EDUCATION HIGH,72X319,X319,HIGH SCHOOL,2,12,6,5,22.2,13.5,7,17.9,9.5
2023,PELHAM LAB HIGH SCHOOL,72X320,X320,HIGH SCHOOL,3,29,11,16,9.5,4.9,13,8.1,5
2023,DREAMYARD PREPARATORY SCHOOL,72X329,X329,HIGH SCHOOL,2,26,8,7,8.2,5,19,6.1,4.1
2023,INTERNATIONAL COMMUNITY HIGH SCHOOL,72X334,X334,HIGH SCHOOL,3,27,14,14,12,8.9,13,8.6,5.6
2023,SCHUYLERVILLE PREPARATORY HIGH SCHOOL,72X348,X348,HIGH SCHOOL,3,27,7,12,10.9,5.5,15,12.6,5.1
2023,BRONX RIVER HIGH SCHOOL,72X349,X349,HIGH SCHOOL,3,35,11,15,6.6,3.7,20,10.4,5.3
2023,NEW DIRECTIONS SECONDARY SCHOOL,72X350,X350,HIGH SCHOOL,2,15,6,5,5.4,2.9,10,10,5.1
2023,BRONX COLLABORATIVE HIGH SCHOOL,72X351,X351,HIGH SCHOOL,3,38,10,15,8.1,3.9,23,8.8,4.1
2023,WORLD VIEW HIGH SCHOOL,72X353,X353,HIGH SCHOOL,4,48,14,19,4.2,3,29,5.7,3.7
2023,ACADEMY FOR LANGUAGE AND TECHNOLOGY,72X365,X365,HIGH SCHOOL,2,23,5,9,5.5,4.6,14,3.6,3.6
2023,KNOWLEDGE AND POWER PREPARATORY ACADEMY INTERNATIO,72X374,X374,HIGH SCHOOL,3,32,7,14,4.6,3.9,18,6.7,3.3
2023,BRONX COMMUNITY HIGH SCHOOL,72X377,X377,HIGH SCHOOL,2,11,3,*,,,*,,
2023,JILL CHAIFETZ TRANSFER HIGH SCHOOL,72X379,X379,HIGH SCHOOL,2,18,8,8,17.4,6.7,10,11,4.5
2023,BRONX HAVEN HIGH SCHOOL,72X381,X381,HIGH SCHOOL,1,13,4,8,12.7,4.2,5,9.7,4.1
2023,PAN AMERICAN INTERNATIONAL HIGH SCHOOL AT MONROE,72X388,X388,HIGH SCHOOL,3,26,5,11,7,6.2,15,9.4,6.1
2023,ENGLISH LANGUAGE LEARNERS AND INTERNATIONAL SUPPOR,72X397,X397,HIGH SCHOOL,3,22,8,7,10.3,4.4,15,13.2,6.3
2023,BRONX INTERNATIONAL HIGH SCHOOL,72X403,X403,HIGH SCHOOL,4,25,10,11,10.6,7.4,14,12.5,5.2
2023,SCHOOL FOR EXCELLENCE,72X404,X404,HIGH SCHOOL,2,16,8,7,16.3,8.4,9,9.7,3.4
2023,HERBERT H. LEHMAN HIGH SCHOOL,72X405,X405,HIGH SCHOOL,7,80,28,32,11.7,10.6,48,8.7,6.6
2023,BRONX HIGH SCHOOL OF BUSINESS,72X412,X412,HIGH SCHOOL,3,30,11,13,12.1,6.4,17,7.9,4.5
2023,BRONX HIGH SCHOOL FOR THE VISUAL ARTS,72X418,X418,HIGH SCHOOL,2,33,11,14,9.4,5.9,19,11.7,7.6
2023,COMMUNITY SCHOOL FOR SOCIAL JUSTICE,72X427,X427,HIGH SCHOOL,3,19,8,8,12.3,10,11,12.6,7.6
2023,BRONX BRIDGES HIGH SCHOOL,72X432,X432,HIGH SCHOOL,3,30,8,12,4.6,2.7,18,3.9,2.8
2023,HIGH SCHOOL FOR TEACHING AND THE PROFESSIONS,72X433,X433,HIGH SCHOOL,3,36,11,13,14.3,9.3,23,12,6.1
2023,BELMONT PREPARATORY HIGH SCHOOL,72X434,X434,HIGH SCHOOL,3,25,11,11,15.2,10.4,14,15.1,8.8
2023,FORDHAM HIGH SCHOOL FOR THE ARTS,72X437,X437,HIGH SCHOOL,3,29,8,12,1.9,1.7,17,3.7,3
2023,FORDHAM LEADERSHIP ACADEMY,72X438,X438,HIGH SCHOOL,2,33,5,11,4.1,2.1,22,3.2,2.4
2023,BRONX HIGH SCHOOL FOR LAW AND COMMUNITY SERVICE,72X439,X439,HIGH SCHOOL,3,34,8,19,10,6.6,15,10.9,7.3
2023,DEWITT CLINTON HIGH SCHOOL,72X440,X440,HIGH SCHOOL,7,74,19,31,7.9,5.6,43,6.1,4.5
2023,CELIA CRUZ BRONX HIGH SCHOOL OF MUSIC  THE,72X442,X442,HIGH SCHOOL,3,32,11,15,10.2,7,17,13.4,10.2
2023,THE BRONX HIGH SCHOOL OF SCIENCE,72X445,X445,HIGH SCHOOL,10,138,24,73,12.8,9.7,65,10.3,8.6
2023,ARTURO A. SCHOMBURG SATELLITE ACADEMY BRONX,72X446,X446,HIGH SCHOOL,2,14,4,*,,,*,,
2023,GOTHAM COLLABORATIVE HIGH SCHOOL,72X452,X452,HIGH SCHOOL,1,31,10,18,12.5,6,13,13.5,5.7
2023,HARRY S TRUMAN HIGH SCHOOL,72X455,X455,HIGH SCHOOL,9,130,34,59,11.4,9.1,71,10.6,8.6
2023,MOTT HAVEN VILLAGE PREPARATORY HIGH SCHOOL,72X473,X473,HIGH SCHOOL,3,17,13,6,9.9,8.8,11,11.9,6.8
2023,MARBLE HILL HIGH SCHOOL FOR INTERNATIONAL STUDIES,72X477,X477,HIGH SCHOOL,3,33,10,12,14.7,10.4,21,11.7,7.2
2023,THE CINEMA SCHOOL,72X478,X478,HIGH SCHOOL,3,26,5,8,6.2,5.1,18,8.2,3.8
2023,BRONX CAREER AND COLLEGE PREPARATORY HIGH SCHOOL,72X479,X479,HIGH SCHOOL,2,17,8,9,9.2,4.2,8,8.9,3
2023,BRONX REGIONAL HIGH SCHOOL,72X480,X480,HIGH SCHOOL,2,8,4,*,,,*,,
2023,UNIVERSITY HEIGHTS SECONDARY SCHOOL,72X495,X495,HIGH SCHOOL,3,31,14,12,13.6,10,19,9.9,7.7
2023,BRONXDALE HIGH SCHOOL,72X508,X508,HIGH SCHOOL,3,41,10,19,8.4,5.9,22,7.2,5
2023,HIGH SCHOOL OF LANGUAGE AND INNOVATION,72X509,X509,HIGH SCHOOL,3,30,6,12,8.8,4.9,18,7,3.9
2023,BRONX ENVISION ACADEMY,72X511,X511,HIGH SCHOOL,3,35,9,13,8.2,5.8,22,10.9,5.7
2023,NEW WORLD HIGH SCHOOL,72X513,X513,HIGH SCHOOL,3,22,5,7,14,13.5,15,10.1,9.7
2023,THE BRONXWOOD PREPARATORY ACADEMY,72X514,X514,HIGH SCHOOL,3,26,11,11,10.3,9.1,15,6.8,6
2023,FREDERICK DOUGLASS ACADEMY III SECONDARY SCHOOL,72X517,X517,HIGH SCHOOL,2,24,4,8,14.3,8.5,16,9.8,7.7
2023,THE METROPOLITAN SOUNDVIEW HIGH SCHOOL,72X521,X521,HIGH SCHOOL,2,36,12,15,6.7,3.8,21,9.6,4.5
2023,BRONX DESIGN AND CONSTRUCTION ACADEMY,72X522,X522,HIGH SCHOOL,3,27,16,12,13.7,6.1,15,10.5,5.1
2023,CROTONA INTERNATIONAL HIGH SCHOOL,72X524,X524,HIGH SCHOOL,3,24,5,12,5.6,3,12,7.1,3.8
2023,BRONX LEADERSHIP ACADEMY HIGH SCHOOL,72X525,X525,HIGH SCHOOL,3,28,10,7,6.6,5.7,21,9.2,6.7
2023,BRONX LEADERSHIP ACADEMY II HIGH SCHOOL,72X527,X527,HIGH SCHOOL,4,39,17,18,10.4,4.6,21,7.3,5.5
2023,LONGWOOD PREPARATORY ACADEMY,72X530,X530,HIGH SCHOOL,3,34,10,12,11,5.4,22,7.7,3.4
2023,PELHAM PREPARATORY ACADEMY,72X542,X542,HIGH SCHOOL,3,33,7,12,11.9,6.6,21,9.8,6.7
2023,HIGH SCHOOL FOR VIOLIN AND DANCE,72X543,X543,HIGH SCHOOL,3,15,2,8,8.5,2.6,7,7.6,2.9
2023,HIGH SCHOOL FOR CONTEMPORARY ARTS,72X544,X544,HIGH SCHOOL,3,24,8,12,15.5,6.8,12,12.9,6.5
2023,BRONX AEROSPACE HIGH SCHOOL,72X545,X545,HIGH SCHOOL,2,18,7,7,15.3,9.2,11,18.3,7.8
2023,BRONX THEATRE HIGH SCHOOL,72X546,X546,HIGH SCHOOL,3,24,12,9,15.1,11.5,15,11.1,5.7
2023,CAREERS IN SPORTS HIGH SCHOOL,72X548,X548,HIGH SCHOOL,4,37,16,12,16.5,9.2,25,13.6,7.6
2023,DISCOVERY HIGH SCHOOL,72X549,X549,HIGH SCHOOL,2,31,8,16,11.7,8.2,15,12.1,8.7
2023,HIGH SCHOOL OF WORLD CULTURES,72X550,X550,HIGH SCHOOL,4,29,8,11,10.2,8.2,18,8.5,5.8
2023,MOTT HAVEN COMMUNITY HIGH SCHOOL,72X557,X557,HIGH SCHOOL,3,25,8,11,15.1,5.5,14,11.7,3.4
2023,WESTCHESTER SQUARE ACADEMY,72X558,X558,HIGH SCHOOL,4,31,10,11,7.2,2.8,20,5.9,3.1
2023,BRONX COMPASS HIGH SCHOOL,72X561,X561,HIGH SCHOOL,4,32,12,14,10.2,4.2,18,10.5,3.1
2023,CLAREMONT INTERNATIONAL HS,72X564,X564,HIGH SCHOOL,3,25,6,9,10.9,6,16,7.4,4.5
2023,HIGH SCHOOL FOR ENERGY AND TECHNOLOGY,72X565,X565,HIGH SCHOOL,4,33,14,13,11.5,4.4,20,4.9,2.5
2023,ALFRED E. SMITH CAREER AND TECHNICAL EDUCATION HIG,72X600,X600,HIGH SCHOOL,4,37,10,21,16.9,13.1,16,14.1,11.3
2023,HEALTH OPPORTUNITIES HIGH SCHOOL,72X670,X670,HIGH SCHOOL,3,22,8,8,10.6,7.8,14,12.9,8.3
2023,FANNIE LOU HAMER FREEDOM HIGH SCHOOL,72X682,X682,HIGH SCHOOL,3,41,11,14,9.9,7.6,27,9.9,5.8
2023,WINGS ACADEMY,72X684,X684,HIGH SCHOOL,3,24,8,8,17.1,11.9,16,12.3,8
2023,HIGH SCHOOL OF AMERICAN STUDIES AT LEHMAN COLLEGE,72X696,X696,HIGH SCHOOL,3,27,3,12,17.9,10.3,15,16.5,7.7
2023,PATHWAYS IN TECHNOLOGY EARLY COLLEGE HIGH SCHOOL (,73K122,K122,HIGH SCHOOL,5,33,12,18,13.1,6.8,15,12.8,4.3
2023,THE BROOKLYN SCHOOL FOR MATH AND RESEARCH,73K168,K168,HIGH SCHOOL,4,28,7,12,6.5,5,16,4.8,3.1
2023,INTERNATIONAL HIGH SCHOOL AT LAFAYETTE,73K337,K337,HIGH SCHOOL,3,23,7,5,14.8,8.8,18,11.4,6.6
2023,HIGH SCHOOL OF SPORTS MANAGEMENT,73K348,K348,HIGH SCHOOL,3,27,6,14,8,3.8,13,8.7,4.4
2023,URBAN ASSEMBLY SCHOOL OF MUSIC AND ART,73K350,K350,HIGH SCHOOL,3,10,4,*,,,*,,
2023,ACADEMY FOR EXCELLENCE IN LEADERSHIP,73K403,K403,HIGH SCHOOL,3,24,12,8,6.4,6.9,16,6.2,4
2023,MIDWOOD HIGH SCHOOL,73K405,K405,HIGH SCHOOL,12,227,52,94,12.3,9.9,133,9.8,7
2023,ACADEMY OF HOSPITALITY AND TOURISM,73K408,K408,HIGH SCHOOL,4,24,8,7,4,2.4,17,5.6,2.3
2023,BROOKLYN COMMUNITY ARTS & MEDIA HIGH SCHOOL (BCAM),73K412,K412,HIGH SCHOOL,3,48,10,20,9.3,5.5,28,12.3,6.1
2023,SCIENCE SKILLS CENTER HIGH SCHOOL FOR SCIENCE  TEC,73K419,K419,HIGH SCHOOL,4,37,11,16,10.6,8.5,21,8.1,4.6
2023,JAMES MADISON HIGH SCHOOL,73K425,K425,HIGH SCHOOL,11,198,59,82,12.8,8.8,116,13.7,10.1
2023,BROOKLYN INTERNATIONAL HIGH SCHOOL,73K439,K439,HIGH SCHOOL,2,25,5,12,13.9,11,13,9.6,8.4
2023,NEW UTRECHT HIGH SCHOOL,73K445,K445,HIGH SCHOOL,12,204,50,73,12.3,10,131,12.2,9.9
2023,BROOKLYN PREPARATORY HIGH SCHOOL,73K488,K488,HIGH SCHOOL,4,39,8,18,11.1,5.4,21,9.9,6.7
2023,BROOKLYN COLLEGIATE: A COLLEGE BOARD SCHOOL,73K493,K493,HIGH SCHOOL,4,36,14,20,6.4,3.6,16,7.8,3.9
2023,FDNY - CAPTAIN VERNON A. RICHARD HIGH SCHOOL FOR F,73K502,K502,HIGH SCHOOL,2,23,7,7,9.8,4.6,16,9.7,6.3
2023,HIGH SCHOOL FOR CIVIL RIGHTS,73K504,K504,HIGH SCHOOL,3,16,5,7,15.8,7.2,9,15,8
2023,FRANKLIN DELANO ROOSEVELT HIGH SCHOOL,73K505,K505,HIGH SCHOOL,12,218,68,98,12.9,10.3,120,9.3,7.1
2023,PERFORMING ARTS AND TECHNOLOGY HIGH SCHOOL,73K507,K507,HIGH SCHOOL,3,28,5,14,8.8,5.7,14,9.5,6.9
2023,WORLD ACADEMY FOR TOTAL COMMUNITY HEALTH HIGH SCHO,73K510,K510,HIGH SCHOOL,2,13,4,5,15.1,6.9,8,9.7,6.5
2023,FREDERICK DOUGLASS ACADEMY VII HIGH SCHOOL,73K514,K514,HIGH SCHOOL,2,18,6,9,8.8,5.1,9,7,3.8
2023,INTERNATIONAL HIGH SCHOOL AT PROSPECT HEIGHTS,73K524,K524,HIGH SCHOOL,3,24,7,8,12.5,10.1,16,10.6,6.8
2023,EDWARD R. MURROW HIGH SCHOOL,73K525,K525,HIGH SCHOOL,14,223,63,90,13.9,10.5,133,13.5,9.5
2023,THE HIGH SCHOOL FOR GLOBAL CITIZENSHIP,73K528,K528,HIGH SCHOOL,1,16,5,8,8.5,6.7,8,6.3,4
2023,SCHOOL FOR HUMAN RIGHTS  THE,73K531,K531,HIGH SCHOOL,2,15,10,5,5.2,1.9,10,13.7,4.1
2023,LEON M. GOLDSTEIN HIGH SCHOOL FOR THE SCIENCES,73K535,K535,HIGH SCHOOL,3,60,23,30,15.4,9.2,30,12.4,7.6
2023,HIGH SCHOOL FOR YOUTH AND COMMUNITY DEVELOPMENT AT,73K537,K537,HIGH SCHOOL,4,23,14,14,10.5,6.3,9,10.4,4.6
2023,HIGH SCHOOL FOR SERVICE & LEARNING AT ERASMUS,73K539,K539,HIGH SCHOOL,3,17,5,9,12.7,7.3,8,7.8,7.5
2023,JOHN DEWEY HIGH SCHOOL,73K540,K540,HIGH SCHOOL,12,153,36,92,11.5,7.2,61,11.2,8.1
2023,EBC HIGH SCHOOL FOR PUBLIC SERVICE - BUSHWICK,73K545,K545,HIGH SCHOOL,4,34,13,20,7.8,7.6,14,7.6,7.4
2023,HIGH SCHOOL FOR PUBLIC SERVICE: HEROES OF TOMORROW,73K546,K546,HIGH SCHOOL,4,30,12,13,17.1,7.8,17,9.9,6.3
2023,BROOKLYN ACADEMY OF SCIENCE AND THE ENVIRONMENT,73K547,K547,HIGH SCHOOL,2,19,8,6,14.1,10,13,9.4,6.8
2023,BROOKLYN SCHOOL FOR MUSIC & THEATRE,73K548,K548,HIGH SCHOOL,3,19,6,9,8.2,6.5,10,13.4,4.1
2023,THE BROOKLYN SCHOOL FOR SOCIAL JUSTICE,73K549,K549,HIGH SCHOOL,3,29,5,13,10.2,6.8,16,8.3,6.6
2023,THE ACADEMY OF URBAN PLANNING AND ENGINEERING,73K552,K552,HIGH SCHOOL,3,35,11,12,10.3,7.1,23,7.4,4.6
2023,BROOKLYN ACADEMY HIGH SCHOOL,73K553,K553,HIGH SCHOOL,2,11,4,*,,,*,,
2023,BROOKLYN COLLEGE ACADEMY,73K555,K555,HIGH SCHOOL,4,34,7,15,10.6,7.1,19,11.6,9.2
2023,BUSHWICK LEADERS HIGH SCHOOL FOR ACADEMIC EXCELLEN,73K556,K556,HIGH SCHOOL,2,34,11,21,7.7,4,13,5.1,3.5
2023,IT TAKES A VILLAGE ACADEMY,73K563,K563,HIGH SCHOOL,3,25,11,12,11.2,8.4,13,16.8,7.3
2023,BUSHWICK COMMUNITY HIGH SCHOOL,73K564,K564,HIGH SCHOOL,3,10,5,*,,,*,,
2023,BROOKLYN COMMUNITY HIGH SCHOOL FOR EXCELLENCE AND,73K566,K566,HIGH SCHOOL,2,17,10,6,12.9,6.8,11,11.6,8.4
2023,BROOKLYN THEATRE ARTS HIGH SCHOOL,73K567,K567,HIGH SCHOOL,3,17,8,7,17.8,8.4,10,16.1,5.2
2023,KURT HAHN EXPEDITIONARY LEARNING SCHOOL,73K569,K569,HIGH SCHOOL,2,18,7,7,6.4,2.4,11,8.5,4.2
2023,VICTORY COLLEGIATE HIGH SCHOOL,73K576,K576,HIGH SCHOOL,2,16,7,5,14.8,6.8,11,15.3,6.1
2023,BROOKLYN BRIDGE ACADEMY,73K578,K578,HIGH SCHOOL,2,13,3,*,,,*,,
2023,MULTICULTURAL HIGH SCHOOL,73K583,K583,HIGH SCHOOL,2,23,6,10,7.6,4.7,13,4.3,2.9
2023,KHALIL GIBRAN INTERNATIONAL ACADEMY,73K592,K592,HIGH SCHOOL,2,17,5,*,,,*,,
2023,GOTHAM PROFESSIONAL ARTS ACADEMY,73K594,K594,HIGH SCHOOL,2,21,5,7,12.6,7,14,9.5,2.7
2023,BEDFORD ACADEMY HIGH SCHOOL,73K595,K595,HIGH SCHOOL,1,23,7,7,17.8,9.5,16,13.5,5.9
2023,CLARA BARTON HIGH SCHOOL,73K600,K600,HIGH SCHOOL,8,90,41,39,12.7,8.4,51,11.3,7.3
2023,ORIGINS HIGH SCHOOL,73K611,K611,HIGH SCHOOL,3,38,9,19,7.7,4.8,19,5.5,3.7
2023,TRANSIT TECH CAREER AND TECHNICAL EDUCATION HIGH S,73K615,K615,HIGH SCHOOL,6,78,26,46,16.2,8.6,32,9.6,4.7
2023,BROOKLYN HIGH SCHOOL FOR LEADERSHIP AND COMMUNITY,73K616,K616,HIGH SCHOOL,3,13,4,7,12.1,5.9,6,11.2,8.1
2023,HIGH SCHOOL FOR INNOVATION IN ADVERTISING AND MEDI,73K617,K617,HIGH SCHOOL,4,28,6,9,6.8,4.8,19,8.1,2.8
2023,ACADEMY OF INNOVATIVE TECHNOLOGY,73K618,K618,HIGH SCHOOL,3,35,9,20,7.8,7.6,15,8.4,4.6
2023,CULTURAL ACADEMY FOR THE ARTS AND SCIENCES,73K629,K629,HIGH SCHOOL,3,22,8,8,17.3,6.8,14,8,3.1
2023,PROFESSIONAL PATHWAYS HIGH SCHOOL,73K630,K630,HIGH SCHOOL,3,17,4,10,11.1,6.3,7,12.8,6.7
2023,HIGH SCHOOL FOR MEDICAL PROFESSIONS,73K633,K633,HIGH SCHOOL,3,30,5,11,12.2,7.5,19,12.8,7.3
2023,OLYMPUS ACADEMY,73K635,K635,HIGH SCHOOL,2,16,5,*,,,*,,
2023,ACADEMY FOR CONSERVATION AND THE ENVIRONMENT,73K637,K637,HIGH SCHOOL,3,30,10,14,9.3,4.7,16,6.9,4
2023,BROOKLYN LAB SCHOOL,73K639,K639,HIGH SCHOOL,4,27,9,8,14.6,4.9,19,13.2,6
2023,URBAN ACTION ACADEMY,73K642,K642,HIGH SCHOOL,3,10,5,*,,,*,,
2023,BROOKLYN DEMOCRACY ACADEMY,73K643,K643,HIGH SCHOOL,2,14,5,7,5.7,4.6,7,6.1,1.6
2023,ASPIRATIONS DIPLOMA PLUS HIGH SCHOOL,73K646,K646,HIGH SCHOOL,3,14,5,6,8,7.1,8,20.6,7.2
2023,CYPRESS HILLS COLLEGIATE PREPARATORY SCHOOL,73K659,K659,HIGH SCHOOL,3,29,9,11,7.7,4.9,18,7.8,4.8
2023,W. H. MAXWELL CAREER AND TECHNICAL EDUCATION HIGH,73K660,K660,HIGH SCHOOL,4,46,18,13,8.5,5.2,33,14.4,9.9
2023,SUNSET PARK HIGH SCHOOL,73K667,K667,HIGH SCHOOL,6,112,17,46,7.8,5.9,66,8.2,6
2023,BENJAMIN BANNEKER ACADEMY,73K670,K670,HIGH SCHOOL,5,48,17,16,10.3,7.9,32,13,7.4
2023,SCHOOL FOR CLASSICS HIGH SCHOOL,73K683,K683,HIGH SCHOOL,2,22,6,6,12.9,5.5,16,9.2,5.4
2023,MILLENNIUM BROOKLYN HS,73K684,K684,HIGH SCHOOL,4,66,9,23,10.4,6.6,43,9.1,5.2
2023,TEACHERS PREPARATORY HIGH SCHOOL,73K697,K697,HIGH SCHOOL,2,18,8,5,15.2,12,13,17.4,11.7
2023,BROOKLYN INSTITUTE FOR LIBERAL ARTS,73K745,K745,HIGH SCHOOL,4,37,10,16,3.3,3.3,21,3.8,2.6
2023,ACADEMY FOR HEALTH CAREERS,73K751,K751,HIGH SCHOOL,3,18,3,8,7.5,6.1,10,13.7,5.6
